K,class,class_label,modal_n,modal_pct,AvePP,OCC,classification_note,OCC_note
5,1,C1 Network-oriented prevention responders,73,14.6,0.939,90.32,Excellent AvePP,Strong OCC
5,2,C2 Escalation-aware mixed responders,146,29.1,0.94,38.11,Excellent AvePP,Strong OCC
5,3,C3 Life-threat protective responders,96,19.2,0.937,62.76,Excellent AvePP,Strong OCC
5,4,C4 Boundary-clarification persuaders,110,22,0.947,62.92,Excellent AvePP,Strong OCC
5,5,C5 Multi-action institutional responders,76,15.2,0.842,29.9,Acceptable AvePP,Strong OCC
